{
  "schemaVersion": 1,
  "id": "adaptive-feature-example",
  "title": "Adaptive feature delivery",
  "goal": "Turn an ambiguous product idea into a verified release using only the capabilities and gates the risk requires.",
  "nodes": [
    {
      "id": "define-goal",
      "title": "Define the outcome",
      "goal": "Record the user outcome, scope, constraints, risks, and measurable acceptance criteria.",
      "kind": "work",
      "status": "completed",
      "capabilities": ["product-orchestration"],
      "dependencies": [],
      "risk": "medium",
      "writesProduction": false,
      "writeScope": ["docs/agents/**"],
      "deliverables": ["Decision-ready product brief"],
      "acceptanceChecks": ["The goal describes a user outcome rather than an implementation", "Acceptance criteria are observable"],
      "evidence": ["docs/agents/adaptive-orchestration.md"]
    },
    {
      "id": "design-research",
      "title": "Explore system taste and current design ideas",
      "goal": "Study existing Framework decisions, dated trend evidence, accessibility, performance, and two or three isolated design directions.",
      "kind": "work",
      "status": "pending",
      "capabilities": ["design-exploration", "brand-content"],
      "dependencies": ["define-goal"],
      "risk": "medium",
      "writesProduction": false,
      "writeScope": ["docs/research/design/**", "prototypes/**"],
      "deliverables": ["Dated design research", "Isolated design alternatives"],
      "acceptanceChecks": ["Every trend has a source and capture date", "Alternatives preserve accepted Framework decisions", "Accessibility and performance costs are stated"],
      "evidence": []
    },
    {
      "id": "technical-research",
      "title": "Research implementation, security, and privacy",
      "goal": "Trace current architecture and gather current primary-source evidence for technical, security, privacy, and compatibility decisions.",
      "kind": "work",
      "status": "pending",
      "capabilities": ["full-stack-implementation", "security-privacy"],
      "dependencies": ["define-goal"],
      "risk": "high",
      "writesProduction": false,
      "writeScope": ["docs/research/technical/**"],
      "deliverables": ["Technical options and threat notes"],
      "acceptanceChecks": ["Current code paths and contracts are cited", "Privacy and security claims use current primary sources", "Compatibility boundaries are explicit"],
      "evidence": []
    },
    {
      "id": "ux-benchmark-research",
      "title": "Benchmark the user workflow",
      "goal": "Compare task completion, language, friction, and error recovery with relevant tools and existing TechiesTools behavior.",
      "kind": "work",
      "status": "pending",
      "capabilities": ["ux-benchmarking"],
      "dependencies": ["define-goal"],
      "risk": "medium",
      "writesProduction": false,
      "writeScope": ["docs/research/ux/**"],
      "deliverables": ["Task-based UX benchmark"],
      "acceptanceChecks": ["Comparisons use equivalent user tasks", "Findings distinguish observation from preference"],
      "evidence": []
    },
    {
      "id": "direction-brief",
      "title": "Synthesize a direction",
      "goal": "Combine design, technical, and UX evidence into a recommendation with objections, alternatives, and explicit trade-offs.",
      "kind": "work",
      "status": "pending",
      "capabilities": ["product-orchestration", "design-exploration"],
      "dependencies": ["design-research", "technical-research", "ux-benchmark-research"],
      "risk": "medium",
      "writesProduction": false,
      "writeScope": ["docs/decisions/**"],
      "deliverables": ["Direction brief"],
      "acceptanceChecks": ["Recommendation traces to evidence", "Strongest objection and credible alternative are included"],
      "evidence": []
    },
    {
      "id": "direction-gate",
      "title": "Approve the direction",
      "goal": "Let the product owner approve or reject the proposed direction before additional design work.",
      "kind": "human-gate",
      "status": "pending",
      "capabilities": ["product-orchestration"],
      "dependencies": ["direction-brief"],
      "risk": "medium",
      "writesProduction": false,
      "writeScope": [],
      "deliverables": ["Recorded direction decision"],
      "acceptanceChecks": ["Decision records approver and rationale"],
      "evidence": []
    },
    {
      "id": "design-prototypes",
      "title": "Prototype the approved direction",
      "goal": "Build isolated throwaway variants that answer the approved product and design questions without mutating production Framework behavior.",
      "kind": "work",
      "status": "pending",
      "capabilities": ["design-exploration", "full-stack-implementation"],
      "dependencies": ["direction-gate"],
      "risk": "medium",
      "writesProduction": false,
      "writeScope": ["prototypes/**"],
      "deliverables": ["Two or three comparable prototypes"],
      "acceptanceChecks": ["Each variant answers the same question", "Prototype-only state is isolated", "Rendered behavior is captured"],
      "evidence": []
    },
    {
      "id": "promotion-gate",
      "title": "Promote one prototype",
      "goal": "Choose one outcome for production implementation or reject all variants.",
      "kind": "human-gate",
      "status": "pending",
      "capabilities": ["product-orchestration", "design-exploration"],
      "dependencies": ["design-prototypes"],
      "risk": "high",
      "writesProduction": false,
      "writeScope": [],
      "deliverables": ["Recorded Promotion decision"],
      "acceptanceChecks": ["Decision names the selected outcome and rationale", "Losing variants remain outside production"],
      "evidence": []
    },
    {
      "id": "implementation",
      "title": "Implement the promoted outcome",
      "goal": "Integrate the selected behavior across UI, persistence, Preview, compilation, export, and generated artifacts where applicable.",
      "kind": "work",
      "status": "pending",
      "capabilities": ["full-stack-implementation"],
      "dependencies": ["promotion-gate"],
      "risk": "high",
      "writesProduction": true,
      "writeScope": ["src/**", "tests/**"],
      "deliverables": ["Production implementation", "Automated regression tests"],
      "acceptanceChecks": ["Tests fail before the implementation and pass afterward", "All affected product surfaces agree", "No prototype-only switchers or state remain"],
      "evidence": []
    },
    {
      "id": "functional-qa",
      "title": "Verify functional and edge behavior",
      "goal": "Exercise real routes, breakpoints, keyboard paths, invalid inputs, persistence, output parity, and failure recovery.",
      "kind": "work",
      "status": "pending",
      "capabilities": ["functional-qa"],
      "dependencies": ["implementation"],
      "risk": "high",
      "writesProduction": false,
      "writeScope": ["docs/evidence/qa/**"],
      "deliverables": ["Functional QA evidence"],
      "acceptanceChecks": ["Acceptance criteria and edge cases are exercised", "Failures include reproducible evidence"],
      "evidence": []
    },
    {
      "id": "ux-verification",
      "title": "Verify UX against benchmarks",
      "goal": "Measure whether representative users can understand and complete the target task with acceptable friction.",
      "kind": "work",
      "status": "pending",
      "capabilities": ["ux-benchmarking"],
      "dependencies": ["implementation"],
      "risk": "medium",
      "writesProduction": false,
      "writeScope": ["docs/evidence/ux/**"],
      "deliverables": ["UX verification evidence"],
      "acceptanceChecks": ["Tests use the original target task", "Results compare against the recorded baseline"],
      "evidence": []
    },
    {
      "id": "security-privacy-review",
      "title": "Review security and privacy",
      "goal": "Verify the implemented trust boundaries, data handling, permissions, dependencies, and relevant current requirements.",
      "kind": "work",
      "status": "pending",
      "capabilities": ["security-privacy"],
      "dependencies": ["implementation"],
      "risk": "high",
      "writesProduction": false,
      "writeScope": ["docs/evidence/security/**"],
      "deliverables": ["Security and privacy review"],
      "acceptanceChecks": ["Threats and mitigations map to actual code paths", "Unresolved high-risk findings block release"],
      "evidence": []
    },
    {
      "id": "independent-review",
      "title": "Run fail-closed independent review",
      "goal": "Review the exact current diff and all test evidence without relying on implementation self-report.",
      "kind": "work",
      "status": "pending",
      "capabilities": ["independent-review"],
      "dependencies": ["functional-qa", "ux-verification", "security-privacy-review"],
      "risk": "high",
      "writesProduction": false,
      "writeScope": ["docs/evidence/review/**"],
      "deliverables": ["Independent review verdict"],
      "acceptanceChecks": ["Review targets final HEAD", "Blocking findings are fixed or explicitly rejected with evidence"],
      "evidence": []
    },
    {
      "id": "release-gate",
      "title": "Approve release",
      "goal": "Confirm the goal, acceptance criteria, evidence, and independent review are satisfied before promotion.",
      "kind": "human-gate",
      "status": "pending",
      "capabilities": ["product-orchestration", "independent-review"],
      "dependencies": ["independent-review"],
      "risk": "high",
      "writesProduction": false,
      "writeScope": [],
      "deliverables": ["Recorded release decision"],
      "acceptanceChecks": ["Final HEAD passes required quality gates", "No unresolved release blocker remains"],
      "evidence": []
    }
  ]
}
